{
  "schemaVersion": 1,
  "updatedAt": "2026-07-26T14:18:28.664Z",
  "counts": {
    "total": 87,
    "reviewed": 0,
    "unreviewed": 87
  },
  "authors": [
    {
      "schemaVersion": 1,
      "authorId": "author-eb865625aa",
      "displayName": "（如梦）浑源州",
      "aliases": [],
      "articleIds": [
        "ea-bf1197438fc5"
      ],
      "userPrior": {
        "status": "unreviewed",
        "weight": null,
        "notes": "",
        "reviewedAt": null
      },
      "derivedStatistics": {
        "ratedArticles": 0,
        "meanArticleWeight": null,
        "themeDomainCounts": {
          "restraint-themed": 1
        }
      },
      "createdAt": "2026-07-26T14:11:22.798Z",
      "updatedAt": "2026-07-26T14:18:28.655Z"
    },
    {
      "schemaVersion": 1,
      "authorId": "author-416228a60d",
      "displayName": "（如梦）wmwmwm",
      "aliases": [],
      "articleIds": [
        "ea-f640ced3ae78"
      ],
      "userPrior": {
        "status": "unreviewed",
        "weight": null,
        "notes": "",
        "reviewedAt": null
      },
      "derivedStatistics": {
        "ratedArticles": 0,
        "meanArticleWeight": null,
        "themeDomainCounts": {
          "restraint-themed": 1
        }
      },
      "createdAt": "2026-07-26T14:11:22.798Z",
      "updatedAt": "2026-07-26T14:18:28.655Z"
    },
    {
      "schemaVersion": 1,
      "authorId": "author-9bd699a894",
      "displayName": "白框凉太子",
      "aliases": [],
      "articleIds": [
        "ea-cba63959fd72"
      ],
      "userPrior": {
        "status": "unreviewed",
        "weight": null,
        "notes": "",
        "reviewedAt": null
      },
      "derivedStatistics": {
        "ratedArticles": 0,
        "meanArticleWeight": null,
        "themeDomainCounts": {
          "general-prose": 1
        }
      },
      "createdAt": "2026-07-26T14:11:22.799Z",
      "updatedAt": "2026-07-26T14:18:28.655Z"
    },
    {
      "schemaVersion": 1,
      "authorId": "author-dd3941c811",
      "displayName": "薄红",
      "aliases": [],
      "articleIds": [
        "ea-2be810a3fc2d"
      ],
      "userPrior": {
        "status": "unreviewed",
        "weight": null,
        "notes": "",
        "reviewedAt": null
      },
      "derivedStatistics": {
        "ratedArticles": 0,
        "meanArticleWeight": null,
        "themeDomainCounts": {
          "restraint-themed": 1
        }
      },
      "createdAt": "2026-07-26T14:11:22.798Z",
      "updatedAt": "2026-07-26T14:18:28.655Z"
    },
    {
      "schemaVersion": 1,
      "authorId": "author-c17abfb629",
      "displayName": "笔下风流（如梦）",
      "aliases": [],
      "articleIds": [
        "ea-b946781767c6"
      ],
      "userPrior": {
        "status": "unreviewed",
        "weight": null,
        "notes": "",
        "reviewedAt": null
      },
      "derivedStatistics": {
        "ratedArticles": 0,
        "meanArticleWeight": null,
        "themeDomainCounts": {
          "restraint-themed": 1
        }
      },
      "createdAt": "2026-07-26T14:11:22.798Z",
      "updatedAt": "2026-07-26T14:18:28.655Z"
    },
    {
      "schemaVersion": 1,
      "authorId": "author-bd47f42db5",
      "displayName": "不酸的甜柚子",
      "aliases": [],
      "articleIds": [
        "ea-5c26565e5540"
      ],
      "userPrior": {
        "status": "unreviewed",
        "weight": null,
        "notes": "",
        "reviewedAt": null
      },
      "derivedStatistics": {
        "ratedArticles": 0,
        "meanArticleWeight": null,
        "themeDomainCounts": {
          "general-prose": 1
        }
      },
      "createdAt": "2026-07-26T14:11:22.798Z",
      "updatedAt": "2026-07-26T14:18:28.655Z"
    },
    {
      "schemaVersion": 1,
      "authorId": "author-7b0917455d",
      "displayName": "苍崎蓝子",
      "aliases": [],
      "articleIds": [
        "ea-b8c8c24c3302"
      ],
      "userPrior": {
        "status": "unreviewed",
        "weight": null,
        "notes": "",
        "reviewedAt": null
      },
      "derivedStatistics": {
        "ratedArticles": 0,
        "meanArticleWeight": null,
        "themeDomainCounts": {
          "restraint-themed": 1
        }
      },
      "createdAt": "2026-07-26T14:11:22.798Z",
      "updatedAt": "2026-07-26T14:18:28.655Z"
    },
    {
      "schemaVersion": 1,
      "authorId": "author-693f24a7ff",
      "displayName": "草木木",
      "aliases": [],
      "articleIds": [
        "ea-1c932d07f84f"
      ],
      "userPrior": {
        "status": "unreviewed",
        "weight": null,
        "notes": "",
        "reviewedAt": null
      },
      "derivedStatistics": {
        "ratedArticles": 0,
        "meanArticleWeight": null,
        "themeDomainCounts": {
          "general-prose": 1
        }
      },
      "createdAt": "2026-07-26T14:11:22.799Z",
      "updatedAt": "2026-07-26T14:18:28.655Z"
    },
    {
      "schemaVersion": 1,
      "authorId": "author-357cd58bcf",
      "displayName": "嘲嘲",
      "aliases": [],
      "articleIds": [
        "ea-96f6dd2e9381",
        "ea-d1c8f3bce1cc"
      ],
      "userPrior": {
        "status": "unreviewed",
        "weight": null,
        "notes": "",
        "reviewedAt": null
      },
      "derivedStatistics": {
        "ratedArticles": 0,
        "meanArticleWeight": null,
        "themeDomainCounts": {
          "general-prose": 2
        }
      },
      "createdAt": "2026-07-26T14:11:22.799Z",
      "updatedAt": "2026-07-26T14:18:28.655Z"
    },
    {
      "schemaVersion": 1,
      "authorId": "author-f3450b6a6f",
      "displayName": "楚辞",
      "aliases": [],
      "articleIds": [
        "ea-fbc426a3857d"
      ],
      "userPrior": {
        "status": "unreviewed",
        "weight": null,
        "notes": "",
        "reviewedAt": null
      },
      "derivedStatistics": {
        "ratedArticles": 0,
        "meanArticleWeight": null,
        "themeDomainCounts": {
          "general-prose": 1
        }
      },
      "createdAt": "2026-07-26T14:11:22.799Z",
      "updatedAt": "2026-07-26T14:18:28.655Z"
    },
    {
      "schemaVersion": 1,
      "authorId": "author-d4115dfdaa",
      "displayName": "楚曼白",
      "aliases": [],
      "articleIds": [
        "ea-60f0f174c4dc",
        "ea-520a15057af0",
        "ea-33d2a6c46584",
        "ea-a06e990f8a3f",
        "ea-9b2a81e0dc27",
        "ea-058a30c391ec"
      ],
      "userPrior": {
        "status": "unreviewed",
        "weight": null,
        "notes": "",
        "reviewedAt": null
      },
      "derivedStatistics": {
        "ratedArticles": 0,
        "meanArticleWeight": null,
        "themeDomainCounts": {
          "restraint-themed": 6
        }
      },
      "createdAt": "2026-07-26T14:11:22.798Z",
      "updatedAt": "2026-07-26T14:18:28.655Z"
    },
    {
      "schemaVersion": 1,
      "authorId": "author-f3f13e3efe",
      "displayName": "达国朗兹",
      "aliases": [],
      "articleIds": [
        "ea-18623cd451bf"
      ],
      "userPrior": {
        "status": "unreviewed",
        "weight": null,
        "notes": "",
        "reviewedAt": null
      },
      "derivedStatistics": {
        "ratedArticles": 0,
        "meanArticleWeight": null,
        "themeDomainCounts": {
          "restraint-themed": 1
        }
      },
      "createdAt": "2026-07-26T14:11:22.798Z",
      "updatedAt": "2026-07-26T14:18:28.655Z"
    },
    {
      "schemaVersion": 1,
      "authorId": "author-b088a0c1fb",
      "displayName": "德鲁伊喜欢猪神",
      "aliases": [],
      "articleIds": [
        "ea-e49fc024ffa4"
      ],
      "userPrior": {
        "status": "unreviewed",
        "weight": null,
        "notes": "",
        "reviewedAt": null
      },
      "derivedStatistics": {
        "ratedArticles": 0,
        "meanArticleWeight": null,
        "themeDomainCounts": {
          "restraint-themed": 1
        }
      },
      "createdAt": "2026-07-26T14:11:22.798Z",
      "updatedAt": "2026-07-26T14:18:28.655Z"
    },
    {
      "schemaVersion": 1,
      "authorId": "author-3918ea2973",
      "displayName": "钉刑的圣女",
      "aliases": [],
      "articleIds": [
        "ea-b9cb24f79c0b",
        "ea-cd1720895868"
      ],
      "userPrior": {
        "status": "unreviewed",
        "weight": null,
        "notes": "",
        "reviewedAt": null
      },
      "derivedStatistics": {
        "ratedArticles": 0,
        "meanArticleWeight": null,
        "themeDomainCounts": {
          "restraint-themed": 2
        }
      },
      "createdAt": "2026-07-26T14:11:22.798Z",
      "updatedAt": "2026-07-26T14:18:28.655Z"
    },
    {
      "schemaVersion": 1,
      "authorId": "author-422d88c15b",
      "displayName": "东方冉",
      "aliases": [],
      "articleIds": [
        "ea-ea75b25059db"
      ],
      "userPrior": {
        "status": "unreviewed",
        "weight": null,
        "notes": "",
        "reviewedAt": null
      },
      "derivedStatistics": {
        "ratedArticles": 0,
        "meanArticleWeight": null,
        "themeDomainCounts": {
          "restraint-themed": 1
        }
      },
      "createdAt": "2026-07-26T14:11:22.798Z",
      "updatedAt": "2026-07-26T14:18:28.655Z"
    },
    {
      "schemaVersion": 1,
      "authorId": "author-a7e0e36087",
      "displayName": "咚咚噹117（如梦）",
      "aliases": [],
      "articleIds": [
        "ea-5aa59769abbf",
        "ea-56b84bd8b17f",
        "ea-b2bbd31dd5a5",
        "ea-b6bf11dd8d67",
        "ea-f59c3e21814d"
      ],
      "userPrior": {
        "status": "unreviewed",
        "weight": null,
        "notes": "",
        "reviewedAt": null
      },
      "derivedStatistics": {
        "ratedArticles": 0,
        "meanArticleWeight": null,
        "themeDomainCounts": {
          "restraint-themed": 5
        }
      },
      "createdAt": "2026-07-26T14:11:22.798Z",
      "updatedAt": "2026-07-26T14:18:28.655Z"
    },
    {
      "schemaVersion": 1,
      "authorId": "author-8b086e2319",
      "displayName": "恩养",
      "aliases": [],
      "articleIds": [
        "ea-65319ef56435"